{
  "conversation_id": "conv_00000000000000000000000000000001",
  "created_at": "2026-01-01T00:00:40.000000Z",
  "decided_at": "2026-01-01T00:00:55.000000Z",
  "findings": [],
  "head_commit": "bbbbbbbbbbbbbbbbbbbbbbbbbbbbbbbbbbbbbbbb",
  "module_id": "alpha",
  "review": {
    "author_family": "opencode",
    "decided_via": "board_tool",
    "digest": "sha256:5e0c94cf9a68129debe94b77fcdb730cdbf53f6a419a0b6a5916a7d7536f00e2",
    "escalated_from": null,
    "findings_count": {
      "blocker": 0,
      "major": 0,
      "minor": 0
    },
    "review_id": "boardreview_00000000000000000000000000000025",
    "reviewer_family": "claude",
    "reviewer_kind": "participant",
    "reviewer_participant_id": "part_00000000000000000000000000000004",
    "rule_id": "cross_family/v1",
    "status": "endorsed",
    "updated_at": "2026-01-01T00:00:55.000000Z",
    "verification_id": "boardverify_00000000000000000000000000000021"
  },
  "rule_inputs": {
    "author_family": "opencode",
    "author_participant_id": "part_00000000000000000000000000000003",
    "eligible": [
      {
        "family": "claude",
        "participant_id": "part_00000000000000000000000000000004",
        "pending": 0
      }
    ],
    "last_reviewer_participant_id": null,
    "picked_participant_id": "part_00000000000000000000000000000004",
    "rule_id": "cross_family/v1"
  },
  "schema_version": "room_board_review/v1",
  "summary": {
    "text": "Implementation verified and endorsed.",
    "truncated": false,
    "untrusted": true
  }
}
